,Customer_Name,Date,Ratings,Review_Title,Reviews,Product_name,Price
0,Luis R. Saez,"January 31, 2022",5.0 out of 5 stars,Notebook computer,Great value and product.,"2021 Newest Dell Inspiron 14"" 2-in-1 HD Touchscreen Laptop, 11th Gen Intel Core i3-1115G4, 8GB DDR4 Memory, 256GB PCIe SSD, Webcam, HDMI, WiFi, Backlit Keyboard,Win10 Home, Silver",&598
1,Amazon Customer,"January 15, 2021",4.0 out of 5 stars,Fair enough,Well enough. For that price they could've put a better screen but it's well enough. Up to the date it is working wast enough.,"2021 Newest Dell Inspiron 14"" 2-in-1 HD Touchscreen Laptop, 11th Gen Intel Core i3-1115G4, 8GB DDR4 Memory, 256GB PCIe SSD, Webcam, HDMI, WiFi, Backlit Keyboard,Win10 Home, Silver",&598
2,Matt,"June 7, 2021",1.0 out of 5 stars,Not as advertised!,"This laptop has a picture of a stylus pen in the pictures but is not compatible with ANY stylus pen. It clearly states that it doesn't come with a stylus pen, which is fine. For the price I just bought one separately. Bought laptop because specs were good. Great amount of memory, HD space and Ghz.  Laptop performs functions well and quick. The battery doesn't last less than 6 hrs which is a little less than we would like. The main issue is that the main attraction to these touchscreen 2 in 1's are using stylus pens for art, or simple note taking. It is a main selling point and product description function.  However, the Dell Inspiron 5406 model from Dell comes with a Full FHD screen that is compatible with the Dell Active Pn350m, however this pen only works with FHD 1920x1080 and this laptop has a 1366 x 768 pixels screen.  Not as advertised, I am reaching out to return. Will update later.Not happy that after hours of searching I find that NO STYLUS will work with this screen.","2021 Newest Dell Inspiron 14"" 2-in-1 HD Touchscreen Laptop, 11th Gen Intel Core i3-1115G4, 8GB DDR4 Memory, 256GB PCIe SSD, Webcam, HDMI, WiFi, Backlit Keyboard,Win10 Home, Silver",&598
3,Amazon Customer,"December 20, 2020",5.0 out of 5 stars,Light weight,I haven't used it much yet.  I purchased it because I'm getting my Real Estate license and wanted something lighter to carry with me.  The fact that it will make into a tablet is a plus if I have to use it in the car.Looking forward to using it more,"2021 Newest Dell Inspiron 14"" 2-in-1 HD Touchscreen Laptop, 11th Gen Intel Core i3-1115G4, 8GB DDR4 Memory, 256GB PCIe SSD, Webcam, HDMI, WiFi, Backlit Keyboard,Win10 Home, Silver",&598
4,Robert Hutson,"July 30, 2021",3.0 out of 5 stars,Slower than I wanted but as Inexpensive as I needed,It's OK... It's my desktop now. Does everything it should.,"2021 Newest Dell Inspiron 14"" 2-in-1 HD Touchscreen Laptop, 11th Gen Intel Core i3-1115G4, 8GB DDR4 Memory, 256GB PCIe SSD, Webcam, HDMI, WiFi, Backlit Keyboard,Win10 Home, Silver",&598
5,buyer,"December 30, 2021",2.0 out of 5 stars,Not too happy:(,The keyboard illumination is very poor. I have the control turned up to max and still some keys seem to be over sprayed making it difficult to distinguish. The laptop at times is also unresponsive. :(  I’m returning it,"2021 Newest Dell Inspiron 14"" 2-in-1 HD Touchscreen Laptop, 11th Gen Intel Core i3-1115G4, 8GB DDR4 Memory, 256GB PCIe SSD, Webcam, HDMI, WiFi, Backlit Keyboard,Win10 Home, Silver",&598
6,Amazon Customer,"January 31, 2022",1.0 out of 5 stars,It just doesnt work,"I can't sign in to one of the accounts on the device, and I can't remove the account without signing into it. I can't even factory reset it because that also requires the pin from the account that I can't sign in to. If I try to reset the pin it doesn't let me, and It randomly black screens until it turns off and you cant even turn it off manually because the power button doesn't work and the battery is installed internally so you just have to wait for it to die or take the whole thing apart and unplug the battery put it back in and reassemble it. This thing just plain sucks. Wouldn't recommend buying it.","2021 Newest Dell Inspiron 14"" 2-in-1 HD Touchscreen Laptop, 11th Gen Intel Core i3-1115G4, 8GB DDR4 Memory, 256GB PCIe SSD, Webcam, HDMI, WiFi, Backlit Keyboard,Win10 Home, Silver",&598
7,Estrella Ocampo ,"February 8, 2021",5.0 out of 5 stars,Great overall utility laptop,This laptop works and runs very smoothly. The touchscreen is very responsive. I would definitely recommend this laptop!,"2021 Newest Dell Inspiron 14"" 2-in-1 HD Touchscreen Laptop, 11th Gen Intel Core i3-1115G4, 8GB DDR4 Memory, 256GB PCIe SSD, Webcam, HDMI, WiFi, Backlit Keyboard,Win10 Home, Silver",&598
8,Google Fan,"October 6, 2021",2.0 out of 5 stars,Very disappointed with the display color resolution and the very poor battery life.,Screen display is very poor. Battery does not last 2 hours. Touchscreen not sensitive enough.,"2021 Newest Dell Inspiron 14"" 2-in-1 HD Touchscreen Laptop, 11th Gen Intel Core i3-1115G4, 8GB DDR4 Memory, 256GB PCIe SSD, Webcam, HDMI, WiFi, Backlit Keyboard,Win10 Home, Silver",&598
9,Cristin,"February 6, 2021",5.0 out of 5 stars,Wonderful,"Great product, much bigger than my old one.","2021 Newest Dell Inspiron 14"" 2-in-1 HD Touchscreen Laptop, 11th Gen Intel Core i3-1115G4, 8GB DDR4 Memory, 256GB PCIe SSD, Webcam, HDMI, WiFi, Backlit Keyboard,Win10 Home, Silver",&598
10,Amazon Customer,"December 21, 2020",5.0 out of 5 stars,Love it,Best for money,"2021 Newest Dell Inspiron 14"" 2-in-1 HD Touchscreen Laptop, 11th Gen Intel Core i3-1115G4, 8GB DDR4 Memory, 256GB PCIe SSD, Webcam, HDMI, WiFi, Backlit Keyboard,Win10 Home, Silver",&598
11,Mark Roland,"November 22, 2020",1.0 out of 5 stars,item didn't work,Item did not function. It was returned.,"2021 Newest Dell Inspiron 14"" 2-in-1 HD Touchscreen Laptop, 11th Gen Intel Core i3-1115G4, 8GB DDR4 Memory, 256GB PCIe SSD, Webcam, HDMI, WiFi, Backlit Keyboard,Win10 Home, Silver",&598
12,JK917,"December 29, 2020",5.0 out of 5 stars,Good laptop for a reasonable price.,"It was a Christmas present for my son. Thin, lightweight, nice design. Good quality for the price. Much better than HP I have. Will have to save up and get one for myself. Tired of slow performance of the HP.","2021 Newest Dell Inspiron 14"" 2-in-1 HD Touchscreen Laptop, 11th Gen Intel Core i3-1115G4, 8GB DDR4 Memory, 256GB PCIe SSD, Webcam, HDMI, WiFi, Backlit Keyboard,Win10 Home, Silver",&598
13,Micael Jeffries,"January 24, 2021",5.0 out of 5 stars,Feels good and easy to covert to tablet,"All good. The size, weight, and feel was very good. Not too heavy and easy to flip opennin tablet mode.","2021 Newest Dell Inspiron 14"" 2-in-1 HD Touchscreen Laptop, 11th Gen Intel Core i3-1115G4, 8GB DDR4 Memory, 256GB PCIe SSD, Webcam, HDMI, WiFi, Backlit Keyboard,Win10 Home, Silver",&598
14,Michael,"March 6, 2021",5.0 out of 5 stars,Good price for 2 in 1,Great computer. The touch is not as responsiveas I would like.  Tent option is good for watching media although the glossy screen makes it a little hard to see.,"2021 Newest Dell Inspiron 14"" 2-in-1 HD Touchscreen Laptop, 11th Gen Intel Core i3-1115G4, 8GB DDR4 Memory, 256GB PCIe SSD, Webcam, HDMI, WiFi, Backlit Keyboard,Win10 Home, Silver",&598
15,Jaxon walters,"March 15, 2022",5.0 out of 5 stars,Very happy!,Works very well and fast!,"2021 Newest Dell Inspiron 14"" 2-in-1 HD Touchscreen Laptop, 11th Gen Intel Core i3-1115G4, 8GB DDR4 Memory, 256GB PCIe SSD, Webcam, HDMI, WiFi, Backlit Keyboard,Win10 Home, Silver",&598
16,Kindle Customer,"February 26, 2021",4.0 out of 5 stars,"Pricey, low wifi, but runs really well.","I love how lightweight this laptop is. Its easy to use and the touchscreen offers even more options. A coupke things to note when buying: you will need to do updates right away, wifi strength is not the greatest, battery life could be better but charges quickly, get a screen protector, understand what the safe mode offers. Overall great product,  but maybe a little pricey.","2021 Newest Dell Inspiron 14"" 2-in-1 HD Touchscreen Laptop, 11th Gen Intel Core i3-1115G4, 8GB DDR4 Memory, 256GB PCIe SSD, Webcam, HDMI, WiFi, Backlit Keyboard,Win10 Home, Silver",&598
