,Customer_Name,Date,Ratings,Review_Title,Reviews,Product_name,Price
37,Eclectic Me,"November 9, 2015",1.0 out of 5 stars,"Great initially, useless after 90 days","Like many of the other reviews, the machine is a beast......when it works. Granted, I did get my warranty out of it, only for it starting to fail after. I also know computers do not last long (based on ever increasing technology), but I should have gotten more than a year out of this one. The main issue I see out of this computer as being the culprit is the design flaw. I have replaced the fan twice because the back is flimsy, and it kept bending the fan. After the third time, the extremely fragile components were basically falling apart (the ribbon and it's connectors). This review has nothing to do with the seller, just the company itself, and I doubt I will be buying another Toshiba anytime soon (if ever). I am not a professional computer technician, but I have fixed plenty in my day. One could say that I was too rough when opening the computer to replace the fan, but I did fix it fine the first two times. It really boils down to cheap parts and a bad design. I hate giving bad reviews, but in this case, I really think Toshiba needs to build better products.","Toshiba Flagship 2-in-1 Convertible Tablet UltraBook 15.6"" Touchscreen Laptop P55W-B5318 - Intel Core i7-4510U - 12GB DDR3L Ram Memory - 256GB SSD Solid State Drive Satin Gold",$449.00
38,James C Chen,"July 23, 2015",1.0 out of 5 stars,This is by far the worst purchase I have every made on Amazon,"It is ironic justice that before purchasing this laptop, I have read through negative reviews and thought to myself ""these people just don't know how to updated the drivers, I should be just fine."" Yes, lesson learned, it did quack like a duck.When I bought the laptop 8 months ago, I really liked it and thought I would be pleased with it. Unfortunately, it turned into the worst experience ever (like when you feel like smashing things). Many keys randomly stop working and I still have not found any solution to it. I tried online forums, reloading drivers and anything else imaginable. No luck. I even opened the laptop to confirm that the printed connector is properly connected--it was.Before then, I noticed that keyboard some times works when my palm does not touch the aluminum cover. Occasionally, when touching the metal cover, there is a ""feel of electricity."" (when the charger is connected) Also, the power button is located in such a unfortunate place that I do not remember how many times I hibernated the laptop when picking it up. The keys randomly not working was the last straw for me.","Toshiba Flagship 2-in-1 Convertible Tablet UltraBook 15.6"" Touchscreen Laptop P55W-B5318 - Intel Core i7-4510U - 12GB DDR3L Ram Memory - 256GB SSD Solid State Drive Satin Gold",$449.00
39,Leonard Shelby,"October 29, 2015",1.0 out of 5 stars,Ghost touches.  Defective machine.,"Very decent computer for the price. Very decent quality too. Toshiba customer service leaves something to be desired if you need help - That has not stopped me from buying Toshiba over and over in the past 15 years for kid computers (eg games), replacement work computers (I have a computer abusive and intense job - speed matters).I would rec with any laptop to buy the SquareTrade/ or some like extended warrantee so that you can just get the darn thing fixed if you happen to beat it up - without having to worry if you are still under the manufacturer's warrantee. I have found that Toshiba's hold up pretty well considering the abuse I give laptops though, and are nice for memory, speed and size. The screen quality is excellent.","Toshiba Flagship 2-in-1 Convertible Tablet UltraBook 15.6"" Touchscreen Laptop P55W-B5318 - Intel Core i7-4510U - 12GB DDR3L Ram Memory - 256GB SSD Solid State Drive Satin Gold",$449.00
40,Louis Contento,"July 20, 2015",5.0 out of 5 stars,Amazing laptop,I love this laptop so nice and easy to use a lot of people were saying that they had problems with the wifi card. I personally think that is because they are not using the 5g or AC band they are using the N band i have had no problems at all with slow Internet anywhere. I love how quick the laptop starts up and all the systems run very fast. The speakers on it are wonderful and have perfect clarity at all volume levels. The graphics are great and every thing looks good the computer isnt all that bright tho but overall not bad. I love having the ability to use it as a large book in tablet mode its good for reading textbooks on.,"Toshiba Flagship 2-in-1 Convertible Tablet UltraBook 15.6"" Touchscreen Laptop P55W-B5318 - Intel Core i7-4510U - 12GB DDR3L Ram Memory - 256GB SSD Solid State Drive Satin Gold",$449.00
41,MR S ELSEY,"August 26, 2015",1.0 out of 5 stars,AVOID THIS SELLER!!! DEFECTIVE MERCHANDISE!!!!,"I loved this machine for the first few months I had it then the touch screen started getting ""Ghost Touches"" and randomly placing the cursor in the middle of the text field as I was trying to compose e-mail etc. Now the really fun issue is the cooling fan started making noise and has completely gone out to where the computer throws an alert message to shut it down and return it to toshiba for immediate repair and then powers itself off. So now I am dealing with Toshiba directly as Amazon can't or won't replace the item. The problem is this machine is full of my client's sensitive and confidential information and I cannot keep the machine powered up long enough to delete it. The Seller is absolutely worthless and will not even bother responding to your emails and from what amazon customer service has told me, they have a disconnected phone number. AVOID THIS SELLER AT ALL COST","Toshiba Flagship 2-in-1 Convertible Tablet UltraBook 15.6"" Touchscreen Laptop P55W-B5318 - Intel Core i7-4510U - 12GB DDR3L Ram Memory - 256GB SSD Solid State Drive Satin Gold",$449.00
42,Jason Bogle,"June 15, 2015",5.0 out of 5 stars,I am a developer (currently working mainly with Java) and this laptop has done great for me so far,"This laptop is everything you expect.I am a developer (currently working mainly with Java) and this laptop has done great for me so far.The screen i very nice, clear and vibrant. Haven't noticed any smudges on it yet from using the touch screen. I like reading from the Kindle app on it with it in the ""Audience Mode"" (where it is flipped sitting on the keyboard). That's also good for using Bluestacks (Android emulator) and some of the free games in the Windows Store.I am not much of a PC gamer though, so I cannot say how well it works for games that require a lot of resources.I would definitely recommend this to a friend.","Toshiba Flagship 2-in-1 Convertible Tablet UltraBook 15.6"" Touchscreen Laptop P55W-B5318 - Intel Core i7-4510U - 12GB DDR3L Ram Memory - 256GB SSD Solid State Drive Satin Gold",$449.00
43,Christine C,"January 14, 2021",2.0 out of 5 stars,Touch screen,This would be a nice computer but it will not charge. Can only be used if plugged in. Doesn't have a removable battery. Honestly I am about to return it.,"Toshiba Flagship 2-in-1 Convertible Tablet UltraBook 15.6"" Touchscreen Laptop P55W-B5318 - Intel Core i7-4510U - 12GB DDR3L Ram Memory - 256GB SSD Solid State Drive Satin Gold",$449.00
44,Frank,"March 15, 2019",2.0 out of 5 stars,Screen de-laminates with bubbles,"Not a bad laptop. I got the 16"" and it is a bit large and heavy for frequent toting. My main dissatisfaction is with the screen. When new the screen had a clear crisp deep color that was a pleasure to use. However after a year or so of moderate use, the screen has developed bubbles around the edges and appears to be separating into layers. Not so pleasant to use anymore.","Toshiba Flagship 2-in-1 Convertible Tablet UltraBook 15.6"" Touchscreen Laptop P55W-B5318 - Intel Core i7-4510U - 12GB DDR3L Ram Memory - 256GB SSD Solid State Drive Satin Gold",$449.00
45,Remy Martin,"July 5, 2015",3.0 out of 5 stars,Defective on arrival.,"I just receive my laptop and was impress about speed and technical options it was offered.The negative is........construction.Touch pad sticks and makes screeching noise when you depress,caps locks button you have to depress multiple times to make it work,back lid of the screen uneven.I will return this laptop and try to reorder another one.","Toshiba Flagship 2-in-1 Convertible Tablet UltraBook 15.6"" Touchscreen Laptop P55W-B5318 - Intel Core i7-4510U - 12GB DDR3L Ram Memory - 256GB SSD Solid State Drive Satin Gold",$449.00
46,James W.,"February 21, 2015",4.0 out of 5 stars,Great computer just wished they would have checked out the ...,Great computer just wished they would have checked out the unit before shipping when I got it the battery was bad and needed replaced and in this unit the battery is hard wired into the computer. I chose to send it to Toshiba for replacement instead of back to the where I purchased it because of time involved the only problem with that was my one time replacement warranty for the battery is used up.,"Toshiba Flagship 2-in-1 Convertible Tablet UltraBook 15.6"" Touchscreen Laptop P55W-B5318 - Intel Core i7-4510U - 12GB DDR3L Ram Memory - 256GB SSD Solid State Drive Satin Gold",$449.00
47,John Jeffrey,"June 26, 2015",3.0 out of 5 stars,Try other brands first,Works great if power button actually turns it on. Toshiba customer service provides no customer service and accuses you of damaging product instantly without listening to you. Recommend other manufacturer. If you get lucky with this though and there is no defective parts it is a great laptop.,"Toshiba Flagship 2-in-1 Convertible Tablet UltraBook 15.6"" Touchscreen Laptop P55W-B5318 - Intel Core i7-4510U - 12GB DDR3L Ram Memory - 256GB SSD Solid State Drive Satin Gold",$449.00
48,Alex,"April 4, 2016",1.0 out of 5 stars,Buyer beware!,"EDIT: July 19, 2016:After sending in the keyboard for repair, I received it back and it still didn't work! So I sent it in for repair again, and it has taken over a week because it is still ""waiting for parts!"" I am extremely displeased with this computer and appalled that Toshiba, a company I thought I liked, would sell such a bad computer and have such egregious customer service. DO NOT BUY.This item worked very well for some time. However, the keyboard stopped working after only three months. I contacted Toshiba,who repaired the unit for a $30 shipping fee. To me, it seems ridiculous that I must pay $30 to fix a manufacturer defect. Except just one month later, it stopped working again! Very displeased at the support I have received from Toshiba.","Toshiba Flagship 2-in-1 Convertible Tablet UltraBook 15.6"" Touchscreen Laptop P55W-B5318 - Intel Core i7-4510U - 12GB DDR3L Ram Memory - 256GB SSD Solid State Drive Satin Gold",$449.00
49,docman,"June 30, 2015",4.0 out of 5 stars,Minor Quirks with stiff space bar and wi-fi signal.,"Good laptop, but minor quirks. The spacebar is little sticky and annoying. Screen and built are good. Occasionally wi-fi signals can drop but it is not frequent. Overall a good laptop, wish keys were little more sensitive and wi-fi signal was more stable. One more thingI have noticed is that if I move away from the router the signals are weaker than what my older laptop used to catch!!!.","Toshiba Flagship 2-in-1 Convertible Tablet UltraBook 15.6"" Touchscreen Laptop P55W-B5318 - Intel Core i7-4510U - 12GB DDR3L Ram Memory - 256GB SSD Solid State Drive Satin Gold",$449.00
