,Customer_Name,Date,Ratings,Review_Title,Reviews,Product_name,Price
12,Jacqueline Yumi Kajiya,"April 17, 2016",3.0 out of 5 stars,"Ok, but there are better options","The product is very nice looking, has beautiful design and works well with the options in other positions (e.g. as a tablet)However, I always have problems to type, the buttons have to be hardly pressed.. I have a light hand and struggle with the ""space"" button.The touchpad is other thing that didn't work well, during my first days of usage, for some reason it stopped working. I had to reinstall it many times.. And this happened with my friend who bought the same laptop.His computer even had a problem that the computer stopped to work out of nowhere.. He contacted the costumer service, but still had to pay 30$ to deliver it to the company, and they wanted to charge him more 50$ to fix it.. I don't know, if it's in the warranty date, I don't think it's fair charging him. Just an opinion.Sincerely, I wouldn't recommend to others..","Toshiba Flagship 2-in-1 Convertible Tablet UltraBook 15.6"" Touchscreen Laptop P55W-B5318 - Intel Core i7-4510U - 12GB DDR3L Ram Memory - 256GB SSD Solid State Drive Satin Gold",$449.00
13,ikonkar,"January 28, 2016",4.0 out of 5 stars,"This computer has great speed, great touch response","This computer has great speed, great touch response, turns on and boots up in seconds. Plain and simple it's a great laptop. There is one issue that bugs me to death although. The space bar SUCKS! and I mean SUCKS!!!! I'm just waiting for the warranty to expire and I'm replacing the entire keyboard. The space bar has to literally be struck dead center or very close to dead center and pressed firmly for it to respond. I love the laptop so I haven't returned it because of this, but If I have to do a report or have to do something which requires a whole lot of typing I connect a keyboard to the laptop which to me isn't a big deal especially since I can adjust to display mode and it looks like monitor, but I don't work on the go. I would give it 5 stars if the spacebar wasn't so horrible! I could easily see someone that is on the go trying to use this becoming extremely frustrated! So please be aware of this issue!","Toshiba Flagship 2-in-1 Convertible Tablet UltraBook 15.6"" Touchscreen Laptop P55W-B5318 - Intel Core i7-4510U - 12GB DDR3L Ram Memory - 256GB SSD Solid State Drive Satin Gold",$449.00
14,Kourtney F.,"October 12, 2015",2.0 out of 5 stars,Don't do it.,"When I received the first laptop, the space bar was ""sticky.""  You had to push it down very hard to get it to work.  The second laptop I received (after sending the first one back) had a similar problem, it just wasn't as severe.  The first laptop's touch pad also stopped working in the first week I had it.  I had completed the Windows 10 upgrade, and when I notified Toshiba of the touch pad problem they refused to fix it free of charge because of the upgrade.  They did agree to fix the space bar, but I was still in the return window, so I just returned it instead.  Fast forward about 4 weeks after receiving the new laptop (same model).  The new laptop's space bar is still ""sticky"" just not as bad as the first one's.  Now my screen has split open on the left side and the slit is getting bigger.  Because of the slit, the screen is not holding itself up well and is now falling backward while in use.  But I am outside the return window.  Luckily I have a warranty, but it will not give me what I really want, which is a refund and a completely different model of laptop because this thing is a piece of crap.  Don't buy it.","Toshiba Flagship 2-in-1 Convertible Tablet UltraBook 15.6"" Touchscreen Laptop P55W-B5318 - Intel Core i7-4510U - 12GB DDR3L Ram Memory - 256GB SSD Solid State Drive Satin Gold",$449.00
15,momathew,"January 16, 2016",5.0 out of 5 stars,BEST LAPTOP I HAVE EVER OWNED!!!,This is by far the best computer I have ever owned.  I bought this as an open box item from Amazon Warehouse and it blew away the Dell XPS that i had previously owned.  I use my computer all day everyday for work and transport it around on a regular basis.  The weight of the laptop is excellent compared to typical laptops of this size. It has a very thin form and fits well into my carry bag.  The touchscreen is very responsive and folding the screen back into tablet form works great and snaps into place nicely.  The keys have a nice response to them and the palm pad area is large and works well for people with bigger hands.  I was initially concerned that the addition of the number pad would leave the letter keyboard too small but that hasnt been an issue.The battery life is great and I even run the performance at its highest level available when not connected to power.  Restarts take seconds and the overall performance has been excellent.  I haven't had a single issue with it since purchasing it  Cant say enough good things about it and highly recommend this Toshiba if you are in the market for a laptop of this size. you purchase 6 months ago.,"Toshiba Flagship 2-in-1 Convertible Tablet UltraBook 15.6"" Touchscreen Laptop P55W-B5318 - Intel Core i7-4510U - 12GB DDR3L Ram Memory - 256GB SSD Solid State Drive Satin Gold",$449.00
16,Rick Sanchez,"October 7, 2021",4.0 out of 5 stars,"Purchased 6+ years ago, still no failures",It's a good computer for everyday tasks. A few months ago the fan started making horrible noises upon startup but goes away quickly and it still works fine.,"Toshiba Flagship 2-in-1 Convertible Tablet UltraBook 15.6"" Touchscreen Laptop P55W-B5318 - Intel Core i7-4510U - 12GB DDR3L Ram Memory - 256GB SSD Solid State Drive Satin Gold",$449.00
17,Amazon Customer,"April 3, 2016",5.0 out of 5 stars,Fast startup. Runs nice. Upgrade Windows 8.1 to Windows 10 and all is good!,"Love this laptop. I'm an accountant so having the number pad on the right makes Excel spreadsheets easier to populate. Does make the tablet longer, but I only use the laptop at home - I do not carry it out of the house. Upgraded to Windows 10 after having to install some Windows updates. Got through that and then used Macrium Reflect (free version) to create the bootable USB drive and for weekly backups (we always think it will never happen to us and then one day it did years ago; learned my lesson!). Windows 8.1 was a nightmare even though I have used pcs for decades. So glad for the Windows 10 upgrade, which was free since this machine came with Windows 8.1. Very fast start-up and no lags,although I do not use it for gaming, just web browsing, work files, email, youtube, and video streaming. Was never able to, even with help from a tech-savvy 25 year old, to get a movie purchased from the Microsoft store to steam to my Chromecast to my TV from this laptap We think it was a Windows conflict. Anyhow. nice laptop. Long battery life. Never put it in sleep mode. I always power it off when I'm finished using it.","Toshiba Flagship 2-in-1 Convertible Tablet UltraBook 15.6"" Touchscreen Laptop P55W-B5318 - Intel Core i7-4510U - 12GB DDR3L Ram Memory - 256GB SSD Solid State Drive Satin Gold",$449.00
18,Chinchilla,"June 15, 2017",4.0 out of 5 stars,Great laptop with imminent keyboard failure.,"This laptop overall is great its the keyboard that is awful. The ribbon cable that plugs the keyboard to the motherboard is, from the factory severely kinked in a way that WILL make this laptop useless to type on. I was able to easily replace the keyboard, which cost $18. If you are good with hardware repairs then this laptop is great. Its priced right with a good processor, plentiful amounts of RAM, and a SSD. You can get a 128 GB sd card that fully fits into body to upgrade the amount of storage for cheap. The laptop feels great to type on (with the keyboard working) and has a very solid a durable feel to it. I have no regrets buying this laptop but beware of replacing the keyboard within a couple of months.","Toshiba Flagship 2-in-1 Convertible Tablet UltraBook 15.6"" Touchscreen Laptop P55W-B5318 - Intel Core i7-4510U - 12GB DDR3L Ram Memory - 256GB SSD Solid State Drive Satin Gold",$449.00
19,M. L.,"September 15, 2015",1.0 out of 5 stars,I LOVED this Laptop for the first three weeks I had ...,"I NEVER write reviews, but I had to write a review for this product.  I LOVED this Laptop for the first three weeks I had it....I agree with many of the 5 star reviews - it is a BEAST and a Speed Demon and I had nothing negative to say about it for the first three weeks.  Hands down, the best laptop I have ever owned - and I have owned many!  Then.......the ""A"" key randomly stopped working. I would have to strike it several times and then it would finally work. Then the ""N"" key, followed by the Shift, Enter, and B keys.....intermittently they work just fine, but randomly they stop working entirely. What was a minor annoyance soon became a HUGE problem!!! What good is a laptop if the keyboard literally doesn't work??  I couldn't even unlock the thing because my password contained an ""N"" and I could not type an ""N"" with the defective keyboard.  I went online and read every article from every forum I could find and what I found is that this is not an isolated incident.  Many others have had this same problem. What disturbs me and why I am sending this laptop back is that there is no fix for this problem and nobody really knows if the problem is with the hardware, software, or both.  To my knowledge Toshiba has yet to acknowledge this issue officially, which obviously leads one to assume there is no effort underway to fix this problem.  I am SO DISAPPOINTED because I absolutely love everything else about this laptop!!!!","Toshiba Flagship 2-in-1 Convertible Tablet UltraBook 15.6"" Touchscreen Laptop P55W-B5318 - Intel Core i7-4510U - 12GB DDR3L Ram Memory - 256GB SSD Solid State Drive Satin Gold",$449.00
20,B. Davis,"January 14, 2016",1.0 out of 5 stars,"I have no doubt that many of these laptops work just fine, but as is evidenced by many of the ...","DON'T BUT THIS LAPTOP - Unless you want to take the risk that you will get one of the lemons that are documented by several of the reviews here! I have no doubt that many of these laptops work just fine, but as is evidenced by many of the reviews here there are quite a few defective ones as well. Unfortunately, I received one of those defective computers and have been fighting with Toshiba ever since to try to get them to replace it. They out right refuse to replace the computer -  their solution is that they will ""repair"" it which more that likely means I will be stuck with many of the same issues.Below are some of the times that I've contacted Toshiba customer service (there were other times that I forgot to document the case number);8/29  2015082819044889/17  2015091619528029/19  201509191961556 - Spent over two hours with a technical supervisor doing everything including wiping the laptop completely clean1/14  201601142233593 -  after sucking it up for a couple months and just dealing with all the limitations of this laptop (including losing work whenever I had to do a hard reboot), I once again spent almost an hour on the phone with Toshiba customer service. I emphatically asked them to send me a  replacement laptop, but they refused to do so. The only 'solution' they could offer is that they will have their techs  look it over and try to repair the issues.Buyer beware -  Toshiba's quality control is not what it was previously!","Toshiba Flagship 2-in-1 Convertible Tablet UltraBook 15.6"" Touchscreen Laptop P55W-B5318 - Intel Core i7-4510U - 12GB DDR3L Ram Memory - 256GB SSD Solid State Drive Satin Gold",$449.00
21,Gina,"March 4, 2016",3.0 out of 5 stars,"The computer is amazing, BUT","The computer is amazing, huge. Is beautifully designed, the speakers sound amazing. Is great to watch movies and listen to music.But stupidly fragile, I use it to work and have to carry it around places a lot, I had small accidents with it like It fall to the floor from a chair while in my bag and it now has an open corner in the monitor and keyboard area. So it is a laptop that needs to be used very carefully and better as a desktop since absolutely every time you hit it it will be visible in some way. The fan was not working well and also had to be fixed after 2 months of use.","Toshiba Flagship 2-in-1 Convertible Tablet UltraBook 15.6"" Touchscreen Laptop P55W-B5318 - Intel Core i7-4510U - 12GB DDR3L Ram Memory - 256GB SSD Solid State Drive Satin Gold",$449.00
22,SavvvyShopper,"June 25, 2015",5.0 out of 5 stars,"Good, Reliable Convertible!!","Writing this review on this exact computer!! I have had this for several months now and it performs beautifully. I like the fact that you can fold it into a tablet (it does not undock like a Surface does) and the touch screen comes in handy for many applications. It boots up extremely fast and I have not had any problems with it at all. I previously had an HP touch screen and after a couple of weeks, the touch screen stopped working unless I restarted after having already had it going. Then the touch screen would work again but only until I turned it off and then I had to go through the exact same thing, over and over again and it started lagging on booting up soon after I had it as well. This laptop has not had any of those issues and I am quite pleased with it!! The screen resolution is crisp and clear, the sound is quite good for playing music and although I am not a gamer, the processor seems to keep everything working speedily and smoothly.","Toshiba Flagship 2-in-1 Convertible Tablet UltraBook 15.6"" Touchscreen Laptop P55W-B5318 - Intel Core i7-4510U - 12GB DDR3L Ram Memory - 256GB SSD Solid State Drive Satin Gold",$449.00
23,Will,"April 18, 2016",2.0 out of 5 stars,Very Disappointed with the Durability of this Laptop,"I am very disappointed with this laptop. Within a few months of purchase (Aug 2015), the keyboard stopped working. This was covered by the warranty, but I was still out the shipping cost plus the time it took to ship the laptop to and from Toshiba's repair center. Otherwise, it has worked more or less smoothly. However, it has now been seven months, and the bottom corner of the screen is coming apart at the seam. I have barely taken the laptop out of my house, and so this damage has occurred through the normal process of opening and closing the screen. When I called Toshiba, I was told that this qualified as ""physical damage"", and thus would not be covered by the warranty (and is my responsibility to have repaired at my expense). I feel that this is unacceptable, especially for a unit that is advertised as a ""2-in-1 Convertible Tablet Ultrabook"". I will be very hesitant to look at Toshiba the next time I am in the market for a laptop.","Toshiba Flagship 2-in-1 Convertible Tablet UltraBook 15.6"" Touchscreen Laptop P55W-B5318 - Intel Core i7-4510U - 12GB DDR3L Ram Memory - 256GB SSD Solid State Drive Satin Gold",$449.00
24,Yuli Roberts,"March 3, 2018",3.0 out of 5 stars,i really like the touch screen and the SSD,i really like the touch screen and the SSD. But this laptop was obviously used/refurbished and the seller didnt advertise it this way. Thank God I bought the 3 year protection plan and I have had to use it twice so just be cautious with these purchases and my experience has proved that the warranty is worth the extra money. I have a feeling this laptop may not last much past the 3 year mark after buying.,"Toshiba Flagship 2-in-1 Convertible Tablet UltraBook 15.6"" Touchscreen Laptop P55W-B5318 - Intel Core i7-4510U - 12GB DDR3L Ram Memory - 256GB SSD Solid State Drive Satin Gold",$449.00
25,Amy Parks,"May 15, 2016",3.0 out of 5 stars,and apps so to make the computer work better. Hate the left side though,"Had a lot of issues with this in the beginning with a lot of programming problems, until I had to download a few programs, and apps so to make the computer work better. Hate the left side though. When picking it up, there is a side button that can be easily touched, and turns off your computer, or makes it go to sleep, depending upon the settings.  A laptop should not have side buttons, since people pick them up, and can easily push them to screw things up.","Toshiba Flagship 2-in-1 Convertible Tablet UltraBook 15.6"" Touchscreen Laptop P55W-B5318 - Intel Core i7-4510U - 12GB DDR3L Ram Memory - 256GB SSD Solid State Drive Satin Gold",$449.00
26,Alex,"November 26, 2015",5.0 out of 5 stars,"Super fast, great display, best laptop I've owned. Only one issue and its corrected see review.","6 months in and still loving this laptop. Super fast, love the key board and number pad, windows 10 runs great on it.Only issue was the space bar- read the reviews and there is an issue of the space bar missing taps or not operating when pushed. I had this issue and searched for a solution. Found a hidden solution from another user. Carefully remove the space bar add a small strip of electrical tape to the back of the bar where it contacts the key sensors. The added thickness eliminated the issue of the sensor not picking up the tap of the key and I have had no issues since. Toshiba should have this issue addressed but they seemed clueless?Great computer for the cost and I love running my business from it. One of the cooler running laptops I've owned, nice and thin but great size of screen to work with all day.","Toshiba Flagship 2-in-1 Convertible Tablet UltraBook 15.6"" Touchscreen Laptop P55W-B5318 - Intel Core i7-4510U - 12GB DDR3L Ram Memory - 256GB SSD Solid State Drive Satin Gold",$449.00
27,Sunel,"August 6, 2018",4.0 out of 5 stars,"Had this laptop for three years, still going strong","Had this laptop for 3 years now, still going strong. Battery life has gone down with use of course, I get about 2 hours before it needs to be charged. The other annoyance I've had is the development of tiny internal bubbles along the edges of the screen after about 2 years. Not sure how they developed and most of the time I don't notice it, but I don't think there is a solution for it after searching online.","Toshiba Flagship 2-in-1 Convertible Tablet UltraBook 15.6"" Touchscreen Laptop P55W-B5318 - Intel Core i7-4510U - 12GB DDR3L Ram Memory - 256GB SSD Solid State Drive Satin Gold",$449.00
28,Mark,"September 21, 2015",2.0 out of 5 stars,This purchase was months ago and it's probably a good thing I've waited this long to report my experience,"This purchase was months ago and it's probably a good thing I've waited this long to report my experience, as my emotions would have been too high.Initially, when ordering, I thought this was a great idea.  Yet, when I received this tablet the start button was broken.  The only way to start the tablet was to use a small flat screwdriver.  What's worse is that when returning this to Dream Deal, the vendor, it was like pulling teeth and took two weeks.  Thank goodness amazon was finally able to arbitrate on my behalf and I got my money back.I'm not exactly sure who to blame for this defective tablet, but this didn't keep me from ordering another Toshiba.  Actually my new Toshiba is a better model, purchased through Costco.  I'm very happy with their warranty and the Toshiba Satellite S55t-B.","Toshiba Flagship 2-in-1 Convertible Tablet UltraBook 15.6"" Touchscreen Laptop P55W-B5318 - Intel Core i7-4510U - 12GB DDR3L Ram Memory - 256GB SSD Solid State Drive Satin Gold",$449.00
29,AJ,"June 17, 2015",2.0 out of 5 stars,great door stop. terrible for production.,I am not impressed. I have been using computers since text only. The keyboard works about 30% of the time. I did a complete system restore per Toshiba's instructions. The headphone jack is only mono output and is suppose to be stereo. When you move the damned thing if you touch the power button which is located on the side you lose your work. I spent many hours trying to fix this over last month. Now I am returning it to amazon. Just garbage IMHO. Will not be doing business with toshiba ever again. This is one of several faulty products I have purchased by that brand in five years. Really not happy. Computer is fast. But fast is only good if you can type. Reading on web. Some are insinuating that the keyboard driver has a virus when shipped.,"Toshiba Flagship 2-in-1 Convertible Tablet UltraBook 15.6"" Touchscreen Laptop P55W-B5318 - Intel Core i7-4510U - 12GB DDR3L Ram Memory - 256GB SSD Solid State Drive Satin Gold",$449.00
30,Farzan,"June 13, 2015",5.0 out of 5 stars,THIS LAPTOP IS A BEAST,,"Toshiba Flagship 2-in-1 Convertible Tablet UltraBook 15.6"" Touchscreen Laptop P55W-B5318 - Intel Core i7-4510U - 12GB DDR3L Ram Memory - 256GB SSD Solid State Drive Satin Gold",$449.00
31,RobertR,"June 25, 2015",5.0 out of 5 stars,First One Bad - Second one great,The media could not be loaded.,"Toshiba Flagship 2-in-1 Convertible Tablet UltraBook 15.6"" Touchscreen Laptop P55W-B5318 - Intel Core i7-4510U - 12GB DDR3L Ram Memory - 256GB SSD Solid State Drive Satin Gold",$449.00
32,Kindle Customer,"June 23, 2018",3.0 out of 5 stars,It's good for a couple of years, ,"Toshiba Flagship 2-in-1 Convertible Tablet UltraBook 15.6"" Touchscreen Laptop P55W-B5318 - Intel Core i7-4510U - 12GB DDR3L Ram Memory - 256GB SSD Solid State Drive Satin Gold",$449.00
33,Delaminator,"May 18, 2016",1.0 out of 5 stars,"Was great for a few months, is now unreliable."," after reading much of the reviews i was a bit scared to spend as much but , THIS LAPTOP IS A BEAST, never have i seen anything as fast as this, i should know im an I.T guy, i bought one for my wife, she is an architect, i bought one for my self and another for a client, no problems with WiFi at all, super fast speed, got rid of junk soft that came with it, installed my own stuff, and  just amazing, my recommendation is never use a laptop out of the box, always pay an I.T guy for a friend in the filed to prep it for you ^_^ pls watch the video for more info","Toshiba Flagship 2-in-1 Convertible Tablet UltraBook 15.6"" Touchscreen Laptop P55W-B5318 - Intel Core i7-4510U - 12GB DDR3L Ram Memory - 256GB SSD Solid State Drive Satin Gold",$449.00
34,Ross A. Wood,"September 9, 2016",1.0 out of 5 stars,Checking Toshiba off my list of potential candidates!,"I ordered this through Amazon and had it shipped overseas. It arrived DOA but Amazon agreed to pay for return shipping so I only lost the shipping costs to send it. I manage to find this machine locally and I must say I am really impressed. I have a Surface Pro 2, which I liked but the screen and keyboard size were too small for major computing. It was okay for traveling. The problem with larger laptops is poor batter life, and weight, not to mention slow startup times and spinning hard drives. This computer is like have the bet of all worlds. It's fast and easy to use as a desktop, great battery life (almost 8 hours), quick boot up, can be used as a tablet, and now running Microsoft Windows 10 that is amazing in it's own right. I highly recommend this convertiblre 2-in-1 laptop.","Toshiba Flagship 2-in-1 Convertible Tablet UltraBook 15.6"" Touchscreen Laptop P55W-B5318 - Intel Core i7-4510U - 12GB DDR3L Ram Memory - 256GB SSD Solid State Drive Satin Gold",$449.00
35,Who Cares,"October 6, 2015",1.0 out of 5 stars,What a disappointment...,I will never buy Toshiba laptops again.This is my second Toshiba laptop and the screen on both were inadequate. The first one the screen completely went blank/ died.And this one started getting bubbles all around the edges.And this one doesn't come with the bootable track on the drive to revert to manufacturer settings.,"Toshiba Flagship 2-in-1 Convertible Tablet UltraBook 15.6"" Touchscreen Laptop P55W-B5318 - Intel Core i7-4510U - 12GB DDR3L Ram Memory - 256GB SSD Solid State Drive Satin Gold",$449.00
36,Lu,"December 10, 2015",5.0 out of 5 stars,Nice machine for the price. Speedy and good quality.,"Updated review after using the laptop for almost exactly a year: I really liked this laptop at first, but it's been terribly unreliable for the last couple months.The keyboard and trackpad randomly stop working... Windows pops up a ""do you want to enter tablet mode"" prompt because it thinks I've undocked from a docking station. The keyboard backlight stops working at the same time. Powering off and on again will fix the problem, but that's a nuisance.On two or three occasions, the laptop went completely dead - it shut off while in use (resulting in data loss), and wouldn't power on. Eventually I found hard-reset button that can be pushed with a pin.The WiFi connection drops frequently. I know it's not my access point because my phone and my wife's computer both continue to see the local network. To get the connection back, I can usually just disconnect and reconnect, but sometimes I have to disable and re-enable the WiFi device.And apparently Toshiba has given up on supporting their own products. There were a couple of threads on their forums about these issues, but they have deleted their entire support forum.I'm done with Toshiba.","Toshiba Flagship 2-in-1 Convertible Tablet UltraBook 15.6"" Touchscreen Laptop P55W-B5318 - Intel Core i7-4510U - 12GB DDR3L Ram Memory - 256GB SSD Solid State Drive Satin Gold",$449.00
